<?xml version="1.0" encoding="UTF-8"?>
<biblioteca xmlns:xsi="http://www.w3.org/2001/XMLSchema-instance"
            xsi:noNamespaceSchemaLocation="biblioteca.xsd">

    <!-- libro 1 -->
    <libro titulo="Los siete maridos de Evelyn Hugo" isbn="9788419030733">
        <autor fechaNac="20-12-1983" afiliacion="Independiente">
            <nombre>Taylor Jenkins Reid</nombre>
        </autor>
        <resumen>Una legendaria actriz de Hollywood narra su vida, sus matrimonios 
                    y secretos ocultos a una joven periodista.</resumen>
        <categoria>Novela romántica / Ficción histórica</categoria>
        <paginas>384</paginas>
        <edicion>1</edicion>
        <editorial>
            <nombre>Umbriel Editores</nombre>
            <direccion>Barcelona, España</direccion>
        </editorial>
        <anioedicion>2022</anioedicion>
    </libro>

    <!-- libro 2 -->
    <libro titulo="Bajo la misma estrella" isbn="978-84-15594-30-5">
        <autor fechaNac="24-08-1977" afiliacion="Independiente">
            <nombre>John Green</nombre>
        </autor>
        <resumen>Dos adolescentes con cáncer se conocen en un grupo de apoyo y 
                viven un intenso romance marcado por la enfermedad.</resumen>
        <categoria>Novela romántica / Juvenil</categoria>
        <paginas>304</paginas>
        <edicion>1</edicion>
        <editorial>
            <nombre>Nube de Tinta</nombre>
            <direccion>Barcelona, España</direccion>
        </editorial>
        <anioedicion>2012</anioedicion>
    </libro>

    <!-- libro 3 -->
    <libro titulo="Yo antes de ti" isbn="978-84-15750-80-0">
        <autor fechaNac="04-08-1969" afiliacion="Independiente">
            <nombre>Jojo Moyes</nombre>
        </autor>
        <resumen>Louisa Clark se convierte en cuidadora de Will Traynor, un 
                joven tetrapléjico, desarrollando un amor transformador.</resumen>
        <categoria>Novela romántica / Drama</categoria>
        <paginas>496</paginas>
        <edicion>1</edicion>
        <editorial>
            <nombre>Suma de Letras</nombre>
            <direccion>Madrid, España</direccion>
        </editorial>
        <anioedicion>2014</anioedicion>
    </libro>

    <!-- libro 4 -->
    <libro titulo="Orgullo y prejuicio" isbn="978-84-376-0494-7">
        <autor fechaNac="16-12-1775" afiliacion="Independiente">
            <nombre>Jane Austen</nombre>
        </autor>
        <resumen>La historia de Elizabeth Bennet y el señor Darcy, marcada por 
                malentendidos, orgullo y amor.</resumen>
        <categoria>Novela romántica / Clásico</categoria>
        <paginas>432</paginas>
        <edicion>1</edicion>
        <editorial>
            <nombre>Alianza Editorial</nombre>
            <direccion>Madrid, España</direccion>
        </editorial>
        <anioedicion>1813</anioedicion>
    </libro>

    <!-- libro 5 -->
    <libro titulo="Un cuento perfecto" isbn="978-84-08-22645-0">
        <autor fechaNac="03-07-1984" afiliacion="Independiente">
            <nombre>Elísabet Benavent</nombre>
        </autor>
        <resumen>Margot huye de su vida perfecta y conoce a David, con quien 
                vivirá una historia de amor inesperada.</resumen>
        <categoria>Novela romántica / Contemporánea</categoria>
        <paginas>640</paginas>
        <edicion>1</edicion>
        <editorial>
            <nombre>Penguin Random House Grupo Editorial</nombre>
            <direccion>Barcelona, España</direccion>
        </editorial>
        <anioedicion>2020</anioedicion>
    </libro>

    <!-- libro 6 -->
    <libro titulo="Call Me by Your Name" isbn="978-0-374-53155-6">
        <autor fechaNac="02-01-1951" afiliacion="Independiente">
            <nombre>André Aciman</nombre>
        </autor>
        <resumen>En la Riviera italiana, un joven y un estudiante visitante 
                viven un romance de verano inolvidable.</resumen>
        <categoria>Novela romántica / Drama</categoria>
        <paginas>256</paginas>
        <edicion>1</edicion>
        <editorial>
            <nombre>Farrar, Straus and Giroux</nombre>
            <direccion>Nueva York, EE.UU.</direccion>
        </editorial>
        <anioedicion>2007</anioedicion>
    </libro>

    <!-- libro 7 -->
    <libro titulo="Antes de diciembre" isbn="978-84-18742-41-0">
        <autor fechaNac="31-01-2000" afiliacion="Independiente">
            <nombre>Joana Marcús</nombre>
        </autor>
        <resumen>Jenna, en su primer año universitario, conoce a Jack, con 
                quien vivirá un romance con fecha de caducidad.</resumen>
        <categoria>Novela romántica / Juvenil</categoria>
        <paginas>448</paginas>
        <edicion>1</edicion>
        <editorial>
            <nombre>Crossbooks</nombre>
            <direccion>Barcelona, España</direccion>
        </editorial>
        <anioedicion>2022</anioedicion>
    </libro>

    <!-- libro 8 -->
    <libro titulo="Posdata: Te amo" isbn="978-84-08-07206-4">
        <autor fechaNac="30-09-1981" afiliacion="Independiente">
            <nombre>Cecelia Ahern</nombre>
        </autor>
        <resumen>Holly recibe cartas de su difunto esposo que la ayudan a 
                superar su duelo y seguir adelante.</resumen>
        <categoria>Novela romántica / Drama</categoria>
        <paginas>384</paginas>
        <edicion>1</edicion>
        <editorial>
            <nombre>Ediciones B</nombre>
            <direccion>Barcelona, España</direccion>
        </editorial>
        <anioedicion>2004</anioedicion>
    </libro>

    <!-- libro 9 -->
    <libro titulo="La química del amor" isbn="978-84-18845-50-0">
        <autor fechaNac="1989" afiliacion="Independiente">
            <nombre>Ali Hazelwood</nombre>
        </autor>
        <resumen>Bee Königswasser enfrenta a su rival profesional Levi Ward
                mientras surge una inesperada conexión romántica.</resumen>
        <categoria>Novela romántica / Comedia</categoria>
        <paginas>384</paginas>
        <edicion>1</edicion>
        <editorial>
            <nombre>Contraluz</nombre>
            <direccion>Barcelona, España</direccion>
        </editorial>
        <anioedicion>2023</anioedicion>
    </libro>

    <!-- libro 10 -->
    <libro titulo="La hipótesis del amor" isbn="978-84-18483-96-7">
        <autor fechaNac="1989" afiliacion="Independiente">
            <nombre>Ali Hazelwood</nombre>
        </autor>
        <resumen>Olive Smith finge una relación con un profesor para probar un 
                punto, pero termina involucrando sentimientos reales.</resumen>
        <categoria>Novela romántica / Comedia</categoria>
        <paginas>384</paginas>
        <edicion>1</edicion>
        <editorial>
            <nombre>Contraluz</nombre>
            <direccion>Barcelona, España</direccion>
        </editorial>
        <anioedicion>2021</anioedicion>
    </libro>

    <!-- libro 11 -->
    <libro titulo="La canción de Aquiles" isbn="978-84-18239-14-4">
        <autor fechaNac="24-07-1978" afiliacion="Independiente">
            <nombre>Madeline Miller</nombre>
        </autor>
        <resumen>Relato del romance y destino trágico entre Aquiles y 
                Patroclo en el contexto de la Guerra de Troya.</resumen>
        <categoria>Novela romántica / Mitología</categoria>
        <paginas>416</paginas>
        <edicion>1</edicion>
        <editorial>
            <nombre>Alianza de Novelas</nombre>
            <direccion>Madrid, España</direccion>
        </editorial>
        <anioedicion>2011</anioedicion>
    </libro>

    <!-- libro 12 -->
    <libro titulo="El cuaderno de Noah" isbn="978-84-08-01538-2">
        <autor fechaNac="31-12-1965" afiliacion="Independiente">
            <nombre>Nicholas Sparks</nombre>
        </autor>
        <resumen>La historia de amor entre Noah y Allie, marcada por la pasión, 
                el tiempo y la memoria.</resumen>
        <categoria>Novela romántica / Drama</categoria>
        <paginas>224</paginas>
        <edicion>1</edicion>
        <editorial>
            <nombre>Roca Editorial</nombre>
            <direccion>Barcelona, España</direccion>
        </editorial>
        <anioedicion>1996</anioedicion>
    </libro>

    <!-- libro 13 -->
    <libro titulo="Cumbres borrascosas" isbn="978-84-376-0493-0">
        <autor fechaNac="30-07-1818" afiliacion="Independiente">
            <nombre>Emily Brontë</nombre>
        </autor>
        <resumen>Una historia intensa de amor y venganza entre Heathcliff y 
                Catherine en los páramos de Yorkshire.</resumen>
        <categoria>Novela romántica / Gótica</categoria>
        <paginas>416</paginas>
        <edicion>1</edicion>
        <editorial>
            <nombre>Alianza Editorial</nombre>
            <direccion>Madrid, España</direccion>
        </editorial>
        <anioedicion>1847</anioedicion>
    </libro>
</biblioteca>